watershed,type,category,title,precinct,local,grant,partner,match,benefits,zips
Harris County,Partnership,Warning system,Upgrades and Expansion of the Harris County Flood Warning System,Countywide,0,5000000,3750000,1250000,Improving existing flood monitoring systems to provide additional near-real time information on flooding in Harris County.,-
Harris County,Local,Planning,Countywide Ongoing Planning,Countywide,10000000,0,0,0,Ongoing efforts to identify future projects and work efforts to reduce flooding in Harris County watersheds.,-
Harris County,Local,Administration,Bond Administration,Countywide,10000000,0,0,0,Bond administration with legal and financial professional services,-
Harris County,Local,Drainage improvements,Preliminary Engineering for Large Diameter Tunnels for Stormwater Conveyance,Countywide,20000000,0,0,0,Preliminary engineering for implementation of large diameter tunnels to reduce the risk of flooding across Harris County.,-
Harris County,Partnership,Mapping,Harris County Floodplain Mapping Updates,Countywide,0,25000000,12500000,12500000,Providing more accurate information on the risks of flooding in Harris County.,-
Harris County,Local,Technology,Advanced Emerging Technologies for Flood Damage Reduction,Countywide,25000000,0,0,0,Investigations of new methods to reduce the risk of flooding and associated damages in Harris County.  This can include the use of native vegetation to stabilize channel banks and reduce erosion.,-
Harris County,Local,Construction,Countywide Floodplain Preservation and Right of Way Acquisition,Countywide,50000000,0,0,0,Right of way acquisition along various channels in Harris County in support of District projects and preserve channel conveyance and / or restore natural floodplains in areas subject to frequent flooding.,-
Harris County,Local,Partnerships,Partnership Projects with the Harris County Engineering Department,Countywide,100000000,0,0,0,Jointly funded projects that could reduce the risk of flooding in conjunction with Harris County Engineering Department projects.,-
Harris County,Local,Partnerships,"Partnership Projects with Municipalities, Authorities, and Other Districts in Harris County",Countywide,175000000,0,0,0,Jointly funded projects to address flooding with multi-jurisdictional projects..,-
Harris County,Local,Contingency,Contingency,Countywide,500000000,0,0,0,Unallocated funding for variations in project costs and opportunities identified through public input.,-
Hunting Bayou,Storm Repair,Repairs,Storm Repairs in Hunting Bayou Watershed,1 & 2,0,75000,60000,15000,Approximately 9 repair projects of erosion and infrastructure identified after Hurricane Harvey.,"77009, 77093, 77016, 77028, 77013, 77015, 77547, 77029, 77020, 77026"
Hunting Bayou,Community Input,Study,HCFCD Cost Share of Study with the City of Houston on Wallisville Outfall,1 & 2,500000,0,0,0,Study will investigate flooding problems and identify potential solutions to flooding problems along the H103-00-00 channel.  Project will be coordinated with existing COH plans.,"77009, 77093, 77016, 77028, 77013, 77015, 77547, 77029, 77020, 77026"
Hunting Bayou,Community Input,Construction,"Planning, Right-Of-Way, Design and Construction of a Diversion Channel from H102-00-00 to H100-00-00 through Galena Park",2,10000000,0,0,0,The project could reduce the risk of flooding for structures in lower Hunting Bayou.,"77009, 77093, 77016, 77028, 77013, 77015, 77547, 77029, 77020, 77026"
Hunting Bayou,Local,Construction,"Right-Of-Way Acquisition, Design and Construction of Wallisville Outfall",1 & 2,10000000,0,0,0,The project could reduce the risk of flooding for over 140 structures in the 1% floodplain.,"77009, 77093, 77016, 77028, 77013, 77015, 77547, 77029, 77020, 77026"
Hunting Bayou,Buyout,Buyout,Federal Grant-Funded Volunteer Home Buyouts,2,0,11700000,8775000,2925000,Purchase of approximately 90 buildings.,"77009, 77093, 77016, 77028, 77013, 77015, 77547, 77029, 77020, 77026"
Hunting Bayou,Partnership,Construction,"Design and Construction of  Corps of Engineers Hunting Bayou, Section 211(f) Project",1,0,80000000,70000000,10000000,"The 1% floodplain could be removed from up to 4,450 structures.","77009, 77093, 77016, 77028, 77013, 77015, 77547, 77029, 77020, 77026"
Jackson Bayou,Local,Drainage improvements,Investigations of General Drainage Improvements in Jackson Bayou Watershed,2,500000,0,0,0,"Efforts will investigate flooding problems and evaluate potential solutions to flooding problems to reduce the risk of flooding for up to 4,200 structures in the Jackson Bayou watershed.","77336, 77532"
Jackson Bayou,Subdivision Drainage Improvement,Drainage improvements,Jackson Bayou Subdivision Drainage Improvements,2,0,3000000,2250000,750000,"Design and construction of these projects could reduce the risk of flooding for over 1,900 homes during a 1% rain or flood event.","77336, 77532"
Jackson Bayou,Local,Drainage improvements,"Right-of-Way Acquisition, Design and Construction of General Drainage Improvements in Jackson Bayou Watershed",2,10000000,0,0,0,Design and construction of projects to reduce the risk of flooding in the Jackson Bayou watershed.,"77336, 77532"
Little Cypress Creek,Local,Construction,Design and Construction of Zube Park Stormwater Detention Basin,3,1000000,0,0,0,"This project will reduce the risk of flooding in the Little Cypress Creek watershed.  Projects could include, but not limited to, detention, sediment control, vegetation management, and other flood risk management projects.","77484, 77447, 77433, 77377, 77429"
Little Cypress Creek,Local,Drainage improvements,Construction of Kleb Woods Stormwater Detention Basin Improvements,3,3700000,0,0,0,"This project will reduce the risk of flooding in the Little Cypress Creek watershed.  Projects could include, but not limited to, detention, sediment control, vegetation management, and other flood risk management projects.","77484, 77447, 77433, 77377, 77429"
Little Cypress Creek,Local,Drainage improvements,Construction of Bauer-Hockley Stormwater Detention Basin Improvements,3,3850000,0,0,0,"This project will reduce the risk of flooding in the Little Cypress Creek watershed.  Projects could include, but not limited to, detention, sediment control, vegetation management, and other flood risk management projects.","77484, 77447, 77433, 77377, 77429"
Little Cypress Creek,Buyout,Buyout,Federal Grant-Funded Volunteer Home Buyouts,3 & 4,0,9400000,7050000,2350000,Purchase of approximately 30 buildings.,"77484, 77447, 77433, 77377, 77429"
Little Cypress Creek,Local,Drainage improvements,Construction of Mueschke West Stormwater Detention Basin Improvements,3,10600000,0,0,0,"This project will reduce the risk of flooding in the Little Cypress Creek watershed.  Projects could include, but not limited to, detention, sediment control, vegetation management, and other flood risk management projects.","77484, 77447, 77433, 77377, 77429"
Little Cypress Creek,Local,Construction,"Right-Of-Way Acquisition, Design, and Construction of Kluge Stormwater Detention Basin",4,11000000,0,0,0,"This project will reduce the risk of flooding in the Little Cypress Creek watershed.  Projects could include, but not limited to, detention, sediment control, vegetation management, and other flood risk management projects.","77484, 77447, 77433, 77377, 77429"
Little Cypress Creek,Local,Drainage improvements,Construction of Hegar Stormwater Detention Basin Improvements,3,11800000,0,0,0,"This project will reduce the risk of flooding in the Little Cypress Creek watershed.  Projects could include, but not limited to, detention, sediment control, vegetation management, and other flood risk management projects.","77484, 77447, 77433, 77377, 77429"
Little Cypress Creek,Local,Construction,"ROW, Design, and Construction of Mason Stormwater Detention Basin in Little Cypress Creek watershed",3,13000000,0,0,0,"This project will reduce the risk of flooding in the Little Cypress Creek watershed.  Projects could include, but not limited to, detention, sediment control, vegetation management, and other flood risk management projects.","77484, 77447, 77433, 77377, 77429"
Little Cypress Creek,Subdivision Drainage Improvement,Drainage improvements,Little Cypress Creek Subdivision Drainage Improvements,3 & 4,0,14590000,10942500,3647500,Design and construction of these projects could reduce the risk of flooding for over 200 homes during a 1% rain or flood event.,"77484, 77447, 77433, 77377, 77429"
Little Cypress Creek,Local,Construction,"Right-Of-Way Acquisition, Design, and Construction of Mueschke East Stormwater Detention Basin",3,15900000,0,0,0,"This project will reduce the risk of flooding in the Little Cypress Creek watershed.  Projects could include, but not limited to, detention, sediment control, vegetation management, and other flood risk management projects.","77484, 77447, 77433, 77377, 77429"
Little Cypress Creek,Local,Construction,"Right-Of-Way Acquisition, Design, and Construction of Schiel Stormwater Detention Basin",3,16000000,0,0,0,"This project will reduce the risk of flooding in the Little Cypress Creek watershed.  Projects could include, but not limited to, detention, sediment control, vegetation management, and other flood risk management projects.","77484, 77447, 77433, 77377, 77429"
Little Cypress Creek,Partnership,Study,Frontier Program Downstream of Cypress Rosehill,3 & 4,0,24500000,18375000,6125000,"Investigations to develop and implement a masterplan for reducing the risk of flooding and regional infrastructure development in the lower end of the Little Cypress Creek watershed. Projects could include, but not limited to, detention, sediment control, vegetation management, and other flood risk management projects.","77484, 77447, 77433, 77377, 77429"
Little Cypress Creek,Local,Drainage improvements,Design and Construction of Additional Volume in Little Cypress Creek Stormwater Detention Basins,3 & 4,25000000,0,0,0,"Design and Construction of additional volume in existing stormwater detention basins to reduce the risk of flooding in the watershed.  Projects could include, but not limited to, detention, sediment control, vegetation management, and other flood risk management projects.","77484, 77447, 77433, 77377, 77429"
Little Cypress Creek,Local,Construction,"Management, Right-of-Way Acquisition, Design and Construction of the Little Cypress Creek Frontier Program",3,25950000,0,0,0,Implementation and construction of the Little Cypress Creek Frontier Program could remove the 1% floodplain for over 730 acres in the watershed.,"77484, 77447, 77433, 77377, 77429"
Luce Bayou,Storm Repair,Repairs,Storm Repairs in Luce Bayou Watershed,2,0,75000,60000,15000,Approximately 3 repair projects of erosion and infrastructure identified after Hurricane Harvey.,"77357, 77336, 77535, 77327"
Luce Bayou,Local,Drainage improvements,"Planning, Right-of-Way Acquisition, Design and Construction of General Drainage Improvements in Luce Bayou Watershed",2,500000,0,0,0,Effort will investigate flooding problems and evaluate potential solutions to flooding problems to reduce the risk of flooding in the Luce Bayou watershed.,"77357, 77336, 77535, 77327"
Luce Bayou,Local,Drainage improvements,"Right-of-Way Acquisition, Design and Construction of General Drainage Improvements in Luce Bayou Watershed",2,10000000,0,0,0,"To facilitate drainage improvements benefitting up to 3,000 structures.in the watershed.","77357, 77336, 77535, 77327"
Luce Bayou,Local,Repairs,Luce Bayou Right-of-Way Acquisition and Floodplain Preservation,2,10000000,0,0,0,"Right of way acquisition along Luce Bayou for project support, to preserve channel conveyance and / or restore natural floodplains in areas subject to frequent flooding.","77357, 77336, 77535, 77327"
San Jacinto River,Community Input,Study,Investigations of Potential Detention Sites Around Glendale Dredge Site in Partnership with the City of Houston,1,0,100000,50000,50000,Study will investigate potential sites and benefits for detention in and around Glendale Dredge site in partnership with the City of Houston.,"77029, 77012, 77017, 77547, 77506, 77015, 77503, 77536, 77523, 77571, 77520, 77530,77562, 77049, 77532, 77044, 77338, 77346, 77336,77345, 77339, 77386, 77365, 77357, 77327, 77372, 77306, 77302, 7385, 77380, 77381, 77354"
San Jacinto River,Storm Repair,Repairs,Storm Repairs in San Jacinto River Watershed,"1, 2, & 4",0,600000,480000,120000,Approximately 17 repair projects of erosion and infrastructure identified after Hurricane Harvey.,"77029, 77012, 77017, 77547, 77506, 77015, 77503, 77536, 77523, 77571, 77520, 77530,77562, 77049, 77532, 77044, 77338, 77346, 77336,77345, 77339, 77386, 77365, 77357, 77327, 77372, 77306, 77302, 7385, 77380, 77381, 77354"
San Jacinto River,Partnership,Study,San Jacinto River Watershed Study,"1, 2, & 4",0,2500000,1875000,625000,Study will investigate flooding problems and identify potential solutions to flooding from the San Jacinto River.,"77029, 77012, 77017, 77547, 77506, 77015, 77503, 77536, 77523, 77571, 77520, 77530,77562, 77049, 77532, 77044, 77338, 77346, 77336,77345, 77339, 77386, 77365, 77357, 77327, 77372, 77306, 77302, 7385, 77380, 77381, 77354"
San Jacinto River,Subdivision Drainage Improvement,Drainage improvements,San Jacinto River Subdivision Drainage Improvements,"1, 2, & 4",0,6450000,4837500,1612500,Design and construction of these projects could reduce the risk of flooding for over 500 homes during a 1% rain or flood event.,"77029, 77012, 77017, 77547, 77506, 77015, 77503, 77536, 77523, 77571, 77520, 77530,77562, 77049, 77532, 77044, 77338, 77346, 77336,77345, 77339, 77386, 77365, 77357, 77327, 77372, 77306, 77302, 7385, 77380, 77381, 77354"
San Jacinto River,Local,Drainage improvements,"Planning , Right-Of-Way Acquisition, design and Construction of General Drainage Improvements Near Atascocita",2,10000000,0,0,0,This project could reduce the risk of flooding and facilitate drainage improvements in the area of Atascocita in the San Jacinto River watershed.,"77029, 77012, 77017, 77547, 77506, 77015, 77503, 77536, 77523, 77571, 77520, 77530,77562, 77049, 77532, 77044, 77338, 77346, 77336,77345, 77339, 77386, 77365, 77357, 77327, 77372, 77306, 77302, 7385, 77380, 77381, 77354"
San Jacinto River,Local,Drainage improvements,"Planning , Right-Of-Way Acquisition, design and Construction of General Drainage Improvements East of Lake Houston",2,10000000,0,0,0,This project could reduce the risk of flooding and facilitate drainage improvements in the area east of Lake Houston in the San Jacinto River watershed.,"77029, 77012, 77017, 77547, 77506, 77015, 77503, 77536, 77523, 77571, 77520, 77530,77562, 77049, 77532, 77044, 77338, 77346, 77336,77345, 77339, 77386, 77365, 77357, 77327, 77372, 77306, 77302, 7385, 77380, 77381, 77354"
San Jacinto River,Local,Drainage improvements,"Planning , Right-Of-Way Acquisition, design and Construction of General Drainage Improvements Near Huffman",2,10000000,0,0,0,This project could reduce the risk of flooding and facilitate drainage improvements in the area of Huffman in the San Jacinto River watershed.,"77029, 77012, 77017, 77547, 77506, 77015, 77503, 77536, 77523, 77571, 77520, 77530,77562, 77049, 77532, 77044, 77338, 77346, 77336,77345, 77339, 77386, 77365, 77357, 77327, 77372, 77306, 77302, 7385, 77380, 77381, 77354"
San Jacinto River,Local,Drainage improvements,"Planning , Right-Of-Way Acquisition, design and Construction of General Drainage Improvements Near Kingwood",2,10000000,0,0,0,This project could reduce the risk of flooding and facilitate drainage improvements in the area of Kingwood in the San Jacinto River watershed.,"77029, 77012, 77017, 77547, 77506, 77015, 77503, 77536, 77523, 77571, 77520, 77530,77562, 77049, 77532, 77044, 77338, 77346, 77336,77345, 77339, 77386, 77365, 77357, 77327, 77372, 77306, 77302, 7385, 77380, 77381, 77354"
San Jacinto River,Community Input,Drainage improvements,"Planning, Right-Of-Way, Design and Construction of Conveyance Improvements along Panther Creek",2,10000000,0,0,0,"Planning, right of way acquisition, design and construction of projects to reduce the risk of flooding along Panther Creek.","77029, 77012, 77017, 77547, 77506, 77015, 77503, 77536, 77523, 77571, 77520, 77530,77562, 77049, 77532, 77044, 77338, 77346, 77336,77345, 77339, 77386, 77365, 77357, 77327, 77372, 77306, 77302, 7385, 77380, 77381, 77354"
San Jacinto River,Community Input,Drainage improvements,"East Fork, West Fork and Lake Houston Dredging","1, 2, & 4",0,50000000,40000000,10000000,"Potential partnership project with the City of Houston, Coastal Water Authority, and the State of Texas to permit, design, and complete dredging of the East Fork, West Fork and Lake Houston area waterways to reduce flooding risks.","77029, 77012, 77017, 77547, 77506, 77015, 77503, 77536, 77523, 77571, 77520, 77530,77562, 77049, 77532, 77044, 77338, 77346, 77336,77345, 77339, 77386, 77365, 77357, 77327, 77372, 77306, 77302, 7385, 77380, 77381, 77354"
San Jacinto River,Community Input,Construction,Design and Construction of Additional Gates on Lake Houston in Partnership with the City of Houston,"1, 2, & 4",0,70000000,50000000,20000000,Design and construction of additional gates which could enhance the operation of Lake Houston for reduction of flood risk along the  San Jacinto River.  The partnership and project costs are to be determined.,"77029, 77012, 77017, 77547, 77506, 77015, 77503, 77536, 77523, 77571, 77520, 77530,77562, 77049, 77532, 77044, 77338, 77346, 77336,77345, 77339, 77386, 77365, 77357, 77327, 77372, 77306, 77302, 7385, 77380, 77381, 77354"
San Jacinto River,Partnership,Study,"Funding for Future Partnership Projects Based on Results of Study - for Right-of-Way Acquisition, Design, and Construction of General Drainage Improvements in San Jacinto River Watershed Study","1, 2, & 4",0,75000000,56250000,18750000,"Design and construction of partnership projects to reduce the risk of flooding along the San Jacinto River. Projects could include, but not limited to, detention, sediment control, vegetation management, and other flood risk management projects.","77029, 77012, 77017, 77547, 77506, 77015, 77503, 77536, 77523, 77571, 77520, 77530,77562, 77049, 77532, 77044, 77338, 77346, 77336,77345, 77339, 77386, 77365, 77357, 77327, 77372, 77306, 77302, 7385, 77380, 77381, 77354"
San Jacinto River,Buyout,Buyout,Federal Grant-Funded Volunteer Home Buyouts,"1, 2, & 4",0,112800000,84600000,28200000,Purchase of approximately 470 buildings.,"77029, 77012, 77017, 77547, 77506, 77015, 77503, 77536, 77523, 77571, 77520, 77530,77562, 77049, 77532, 77044, 77338, 77346, 77336,77345, 77339, 77386, 77365, 77357, 77327, 77372, 77306, 77302, 7385, 77380, 77381, 77354"
Sims Bayou,Subdivision Drainage Improvement,Drainage improvements,Sims Bayou Subdivision Drainage Improvements,1 & 2,0,880000,660000,220000,Design and construction of these projects could reduce the risk of flooding for over 50 homes during a 1% rain or flood event.,"77477, 77489, 77053, 77085, 77045, 77047, 77051, 77033, 77048, 77075, 77087, 77061, 77012, 77017, 77587, 77034, 77504"
Sims Bayou,Storm Repair,Repairs,Storm Repairs in Sims Bayou Watershed,1 & 2,0,1525000,1220000,305000,Approximately 44 repair projects of erosion and infrastructure identified after Hurricane Harvey.,"77477, 77489, 77053, 77085, 77045, 77047, 77051, 77033, 77048, 77075, 77087, 77061, 77012, 77017, 77587, 77034, 77504"
Sims Bayou,Community Input,Drainage improvements,"Planning, Right-Of-Way Acquisition, Design, and Construction of Improvements for the Tributaries of C106-00-00",2,2000000,0,0,0,The project could reduce the risk of flooding for structures along tributaries of C106-00-00.  Project will be coordinated with existing City of South Houston and City of Houston plans.,"77477, 77489, 77053, 77085, 77045, 77047, 77051, 77033, 77048, 77075, 77087, 77061, 77012, 77017, 77587, 77034, 77504"
Sims Bayou,Local,Construction,"Planning, Right-Of-Way Acquisition, Design and Construction Along C116-00-00",1,10000000,0,0,0,Could reduce the risk of flooding and could improve local drainage issues for buildings along the channel.  Project will be coordinated with existing COH plans.,"77477, 77489, 77053, 77085, 77045, 77047, 77051, 77033, 77048, 77075, 77087, 77061, 77012, 77017, 77587, 77034, 77504"
Sims Bayou,Local,Construction,"Planning, Right-Of-Way Acquisition, Design and Construction Along C124-00-00",1,10000000,0,0,0,Could reduce the risk of flooding and could improve local drainage issues for buildings along the channel.,"77477, 77489, 77053, 77085, 77045, 77047, 77051, 77033, 77048, 77075, 77087, 77061, 77012, 77017, 77587, 77034, 77504"
Sims Bayou,Local,Construction,"Planning, Right-Of-Way Acquisition, Design and Construction Along C143-00-00",1,10000000,0,0,0,Could reduce the risk of flooding and could improve local drainage issues for buildings along the channel.,"77477, 77489, 77053, 77085, 77045, 77047, 77051, 77033, 77048, 77075, 77087, 77061, 77012, 77017, 77587, 77034, 77504"
Sims Bayou,Local,Construction,"Planning, Right-Of-Way Acquisition, Design and Construction Along C144-00-00",1,10000000,0,0,0,Could reduce the risk of flooding and could improve local drainage issues for buildings along the channel.,"77477, 77489, 77053, 77085, 77045, 77047, 77051, 77033, 77048, 77075, 77087, 77061, 77012, 77017, 77587, 77034, 77504"
Sims Bayou,Partnership,Construction,Design and Construction of C506-01-00-E003,2,0,15000000,11250000,3750000,Provides additional stormwater detention in support of flood damage reduction in Sims Bayou Watershed.  Project will be coordinated with existing COH plans.,"77477, 77489, 77053, 77085, 77045, 77047, 77051, 77033, 77048, 77075, 77087, 77061, 77012, 77017, 77587, 77034, 77504"
Sims Bayou,Partnership,Drainage improvements,"Right-Of-Way Acquisition, Design, and Construction of South Post Oak Stormwater Detention Basin and Channel Conveyance Improvements along C147-00-00",1,0,18170000,13627500,4542500,The project could reduce the risk of  flooding for over 210 structures in the 1% floodplain.,"77477, 77489, 77053, 77085, 77045, 77047, 77051, 77033, 77048, 77075, 77087, 77061, 77012, 77017, 77587, 77034, 77504"
Sims Bayou,Community Input,Repairs,Restore Channel Conveyance Capacity Along C102-00-00,2,0,30000000,15000000,15000000,Major maintenance to restore channel conveyance capacity in partnership with the City of Houston.  Project will be coordinated with existing COH plans.,"77477, 77489, 77053, 77085, 77045, 77047, 77051, 77033, 77048, 77075, 77087, 77061, 77012, 77017, 77587, 77034, 77504"
Sims Bayou,Community Input,Repairs,Restore Channel Conveyance Capacity Along C146-00-00,2,0,30000000,15000000,15000000,Major maintenance to restore channel conveyance capacity in partnership with the City of Houston.  Project will be coordinated with existing COH plans.,"77477, 77489, 77053, 77085, 77045, 77047, 77051, 77033, 77048, 77075, 77087, 77061, 77012, 77017, 77587, 77034, 77504"
Sims Bayou,Partnership,Drainage improvements,"Right-Of-Way Acquisition, Design, and Construction of Stormwater Detention Basin and Channel Conveyance Improvements along Salt Water Ditch",1,0,50000000,37500000,12500000,"The project could reduce the risk of flooding for over 1,900 structures near C118-00-00 in the 1% floodplain.  Project will be coordinated with existing COH plans.","77477, 77489, 77053, 77085, 77045, 77047, 77051, 77033, 77048, 77075, 77087, 77061, 77012, 77017, 77587, 77034, 77504"
Spring Creek,Buyout,Buyout,Federal Grant-Funded Volunteer Home Buyouts,3 & 4,0,300000,225000,75000,Purchase of several buildings.,"77338, 77386, 77373, 77389, 77380, 77381, 77384, 77382, 77354, 77375, 77377, 77355, 77362, 77447, 77484, 77868, 77363"
Spring Creek,Storm Repair,Repairs,Storm Repairs in Spring Creek Watershed,3 & 4,0,450000,360000,90000,Approximately 20 repair projects of erosion and infrastructure identified after Hurricane Harvey.,"77338, 77386, 77373, 77389, 77380, 77381, 77384, 77382, 77354, 77375, 77377, 77355, 77362, 77447, 77484, 77868, 77363"
Spring Creek,Local,Drainage improvements,Investigations of General Drainage Improvements along Spring Creek,3 & 4,500000,0,0,0,Effort will investigate flooding problems and evaluate potential solutions to flooding problems to reduce the risk of flooding in the Spring Creek watershed.,"77338, 77386, 77373, 77389, 77380, 77381, 77384, 77382, 77354, 77375, 77377, 77355, 77362, 77447, 77484, 77868, 77363"
Spring Creek,Subdivision Drainage Improvement,Drainage improvements,Spring Creek Subdivision Drainage Improvements,3 & 4,0,6285000,4713750,1571250,Design and construction of these projects could reduce the risk of flooding for over 500 homes during a 1% rain or flood event.,"77338, 77386, 77373, 77389, 77380, 77381, 77384, 77382, 77354, 77375, 77377, 77355, 77362, 77447, 77484, 77868, 77363"
Spring Creek,Local,Drainage improvements,"Right-of-Way Acquisition, Design and Construction of General Drainage Improvements along Spring Creek",3 & 4,10000000,0,0,0,"Design and construction of a project to reduce the risk of flooding in the Spring Creek watershed.  Projects could include, but not limited to, detention, sediment control, vegetation management, and other flood risk management projects.","77338, 77386, 77373, 77389, 77380, 77381, 77384, 77382, 77354, 77375, 77377, 77355, 77362, 77447, 77484, 77868, 77363"
Spring Creek,Partnership,Construction,"Planning, Right-of-Way Acquisition, Design and Construction of a Reservoir along Spring Creek",3 & 4,0,25000000,12500000,12500000,"This partnership will evaluate the effectiveness, construction, and operation of a reservoir in the Spring Creek watershed.  Projects could include, but not limited to, detention, sediment control, vegetation management, and other flood risk management projects.","77338, 77386, 77373, 77389, 77380, 77381, 77384, 77382, 77354, 77375, 77377, 77355, 77362, 77447, 77484, 77868, 77363"
