watershed,type,category,title,precinct,local,grant,partner,match,benefits,zips
Spring Creek,Local,Construction,Spring Creek Right-of-Way Acquisition and Floodplain Preservation,3 & 4,50000000,0,0,0,"Right of way acquisition along Spring Creek for project support, to preserve channel conveyance and / or restore natural floodplains in areas subject to frequent flooding.","77338, 77386, 77373, 77389, 77380, 77381, 77384, 77382, 77354, 77375, 77377, 77355, 77362, 77447, 77484, 77868, 77363"
Vince Bayou,Storm Repair,Repairs,Storm Repairs in Vince Bayou Watershed,2,0,375000,300000,75000,Approximately 17 repair projects of erosion and infrastructure identified after Hurricane Harvey.,"77012, 77017, 77506, 77503, 77502, 77587, 77504, 77034"
Vince Bayou,Buyout,Buyout,Federal Grant-Funded Volunteer Home Buyouts,2,0,400000,300000,100000,Purchase of several buildings.,"77012, 77017, 77506, 77503, 77502, 77587, 77504, 77034"
Vince Bayou,Local,Study,Investigations of General Drainage Improvements in Vince Bayou Watershed,2,500000,0,0,0,Effort will investigate flooding problems and evaluating potential solutions to flooding problems to reduce the risk of flooding in the Vince Bayou watershed.,"77012, 77017, 77506, 77503, 77502, 77587, 77504, 77034"
Vince Bayou,Local,Drainage improvements,"Right-of-Way Acquisition, Design and Construction of General Drainage Improvements in Vince Bayou Watershed",2,15000000,0,0,0,Design and construction of projects to reduce the risk of flooding in the Vince Bayou watershed.,"77012, 77017, 77506, 77503, 77502, 77587, 77504, 77034"
White Oak Bayou,Community Input,Study,Investigation of Additional Stormwater Detention Basins in the White Oak Bayou Watershed,"1, 2, & 3",0,250000,125000,125000,The project could reduce the risk of flooding for structures in the watershed.  Project will be coordinated with existing COH plans.,"77429, 77065, 77070, 77041, 77064, 77086, 77040, 77043, 77080, 77055, 77092, 77008, 77007, 77002, 77009, 77022, 77091, 77076, 77037, 77088, 77038"
White Oak Bayou,Community Input,Study,Partnership Project with the City of Houston for Feasibility Study of General Drainage Improvements around Hidden Lake Townhomes,4,0,350000,175000,175000,Feasibility study in partnership with the City of Houston will evaluate general drainage improvements that could reduce the risk of flooding for homes in Hidden Lakes Townhomes.,"77429, 77065, 77070, 77041, 77064, 77086, 77040, 77043, 77080, 77055, 77092, 77008, 77007, 77002, 77009, 77022, 77091, 77076, 77037, 77088, 77038"
White Oak Bayou,Community Input,Drainage improvements,"Partnership Project with City of Houston on Planning, Right-of-Way Acquisition, Design, and Construction of General Drainage Improvements along E105-00-00",4,0,2000000,1000000,1000000,"Planning, right of way acquisition, design and construction of this project could reduce the risk of flooding for homes along E105-00-00.","77429, 77065, 77070, 77041, 77064, 77086, 77040, 77043, 77080, 77055, 77092, 77008, 77007, 77002, 77009, 77022, 77091, 77076, 77037, 77088, 77038"
White Oak Bayou,Community Input,Drainage improvements,"Partnership Project with Jersey Village on Right-of-Way Acquisition, Design, and Construction of General Drainage Improvements along E127-00-00",4,0,3000000,1500000,1500000,"Planning, right of way acquisition, design and construction of this project could reduce the risk of flooding for homes along E127-00-00.","77429, 77065, 77070, 77041, 77064, 77086, 77040, 77043, 77080, 77055, 77092, 77008, 77007, 77002, 77009, 77022, 77091, 77076, 77037, 77088, 77038"
White Oak Bayou,Storm Repair,Repairs,Storm Repairs in White Oak Bayou Watershed,"1, 3, & 4",0,6400000,5120000,1280000,Approximately 157 repair projects of erosion and infrastructure identified after Hurricane Harvey.,"77429, 77065, 77070, 77041, 77064, 77086, 77040, 77043, 77080, 77055, 77092, 77008, 77007, 77002, 77009, 77022, 77091, 77076, 77037, 77088, 77038"
White Oak Bayou,Partnership,Construction,Design and Construction of Arbor Oaks Stormwater Detention Basin,1,0,10000000,7500000,2500000,"This stormwater detention basin facilitates completion of the federal project on White Oak Bayou which could reduce the risk of flooding for 1,800 structures in the 2% floodplain.  Project will be coordinated with existing COH plans.","77429, 77065, 77070, 77041, 77064, 77086, 77040, 77043, 77080, 77055, 77092, 77008, 77007, 77002, 77009, 77022, 77091, 77076, 77037, 77088, 77038"
White Oak Bayou,Partnership,Construction,Construction of Inwood Forest East Stormwater Detention Basin,1,0,23000000,17000000,6000000,Design and construction of this project and Inwood Forest West Stormwater Detention Basin could reduce the risk of flooding for over 950 structures in the 1% floodplain,"77429, 77065, 77070, 77041, 77064, 77086, 77040, 77043, 77080, 77055, 77092, 77008, 77007, 77002, 77009, 77022, 77091, 77076, 77037, 77088, 77038"
White Oak Bayou,Partnership,Construction,Construction of Inwood Forest West Stormwater Detention Basin,1 & 4,0,24000000,18000000,6000000,Design and construction of this project and Inwood Forest East Stormwater Detention Basin could reduce the risk of flooding for over 950 structures in the 1% floodplain.  Project will be coordinated with existing COH plans.,"77429, 77065, 77070, 77041, 77064, 77086, 77040, 77043, 77080, 77055, 77092, 77008, 77007, 77002, 77009, 77022, 77091, 77076, 77037, 77088, 77038"
White Oak Bayou,Local,Drainage improvements,"Planning, Right-Of-Way Acquisition, Design and Construction of Little White Oak Bayou Channel Conveyance Improvements",1 & 2,30000000,0,0,0,"Planning, right of way acquisition, design and construction of this project could reduce the risk of flooding for over 1,150 structures in the 1% floodplain.","77429, 77065, 77070, 77041, 77064, 77086, 77040, 77043, 77080, 77055, 77092, 77008, 77007, 77002, 77009, 77022, 77091, 77076, 77037, 77088, 77038"
White Oak Bayou,Partnership,Construction,Design and Construction of Woodland Trails Stormwater Detention Basin,4,0,31000000,23250000,7750000,"This stormwater detention basin facilitates completion of the federal project on White Oak Bayou which could reduce the risk of flooding for 1,800 structures in the 2% floodplain.","77429, 77065, 77070, 77041, 77064, 77086, 77040, 77043, 77080, 77055, 77092, 77008, 77007, 77002, 77009, 77022, 77091, 77076, 77037, 77088, 77038"
White Oak Bayou,Local,Drainage improvements,"Right-Of-Way Acquisition, Design, and Construction of Channel Conveyance Improvements on Brickhouse Gully",4,35000000,0,0,0,"Right of way acquisition, design and construction of this project could reduce  the risk of flooding for over 1,300 structures in the 1% floodplain.  Project will be coordinated with existing COH plans.","77429, 77065, 77070, 77041, 77064, 77086, 77040, 77043, 77080, 77055, 77092, 77008, 77007, 77002, 77009, 77022, 77091, 77076, 77037, 77088, 77038"
White Oak Bayou,Subdivision Drainage Improvement,Drainage improvements,White Oak Bayou Subdivision Drainage Improvements,"1, 3, & 4",0,36250000,27187500,9062500,"Design and construction of these projects could reduce the risk of flooding for over 2,400 homes during a 1% rain or flood event.","77429, 77065, 77070, 77041, 77064, 77086, 77040, 77043, 77080, 77055, 77092, 77008, 77007, 77002, 77009, 77022, 77091, 77076, 77037, 77088, 77038"
White Oak Bayou,Community Input,Drainage improvements,"Right-of-Way Acquisition, Design and Construction of General Drainage Improvements along Turkey Gully",3 & 4,0,40000000,30000000,10000000,Project could reduce the risk of flooding for structures along Turkey Gully in partnership with the City of Houston.,"77429, 77065, 77070, 77041, 77064, 77086, 77040, 77043, 77080, 77055, 77092, 77008, 77007, 77002, 77009, 77022, 77091, 77076, 77037, 77088, 77038"
White Oak Bayou,Partnership,Construction,Design and Construction of Corps of Engineers White Oak Bayou Section 211(f) Project,1 & 4,0,95000000,75000000,20000000,"This project could reduce the risk of flooding for over 1,800 buildings in the 2% floodplain.","77429, 77065, 77070, 77041, 77064, 77086, 77040, 77043, 77080, 77055, 77092, 77008, 77007, 77002, 77009, 77022, 77091, 77076, 77037, 77088, 77038"
White Oak Bayou,Partnership,Construction,"Right-of-Way Acquisition, Design and Construction of the North Canal",2,0,100000000,80000000,20000000,Design and construction of this project could reduce the risk of flooding upstream and downstream of downtown Houston.  Project will be coordinated with existing COH plans.,"77429, 77065, 77070, 77041, 77064, 77086, 77040, 77043, 77080, 77055, 77092, 77008, 77007, 77002, 77009, 77022, 77091, 77076, 77037, 77088, 77038"
White Oak Bayou,Buyout,Buyout,Federal Grant-Funded Volunteer Home Buyouts,1 & 4,0,119300000,89475000,29825000,Purchase of approximately 660 buildings.,"77429, 77065, 77070, 77041, 77064, 77086, 77040, 77043, 77080, 77055, 77092, 77008, 77007, 77002, 77009, 77022, 77091, 77076, 77037, 77088, 77038"
Willow Creek,Local,Study,Investigations of General Drainage Improvements in Willow Creek Watershed,3 & 4,500000,0,0,0,Effort will investigate flooding problems and evaluate potential solutions to flooding problems to reduce the risk of flooding in the Willow Creek watershed.,"77389, 77379, 77375, 77377, 77429, 77433"
Willow Creek,Storm Repair,Repairs,Storm Repairs in Willow Creek Watershed,3 & 4,0,675000,540000,135000,Approximately 12 repair projects of erosion and infrastructure identified after Hurricane Harvey.,"77389, 77379, 77375, 77377, 77429, 77433"
Willow Creek,Local,Construction,Design and Construction of Cypress Rosehill Stormwater Detention Basin,4,1100000,0,0,0,"Providing joint-benefits of mitigating impacts of roadway construction and could reduce the risk of flooding for homes in the surrounding area.  Projects could include, but not limited to, detention, sediment control, vegetation management, and other flood risk management projects.","77389, 77379, 77375, 77377, 77429, 77433"
Willow Creek,Buyout,Buyout,Federal Grant-Funded Volunteer Home Buyouts,4,0,2100000,1575000,525000,Purchase of approximately 10 buildings.,"77389, 77379, 77375, 77377, 77429, 77433"
Willow Creek,Local,Drainage improvements,"Right-of-Way Acquisition, Design and Construction of General Drainage Improvements in Willow Creek Watershed",3 & 4,15000000,0,0,0,Design and construction of projects to reduce the risk of flooding in the Willow Creek watershed.,"77389, 77379, 77375, 77377, 77429, 77433"
Willow Creek,Local,Drainage improvements,Design and Construction of Channel Conveyance Improvements on M124-00-00,4,21000000,0,0,0,The project could reduce the risk of flooding for structures in the 1% floodplain and increase drainage efficiency.,"77389, 77379, 77375, 77377, 77429, 77433"
Willow Creek,Local,Construction,Willow Creek Right-of-Way Acquisition and Floodplain Preservation,3 & 4,30000000,0,0,0,"Right of way acquisition along Willow Creek for project support, to preserve channel conveyance and / or restore natural floodplains in areas subject to frequent flooding.","77389, 77379, 77375, 77377, 77429, 77433"
